Qual é a sua função?,"Desculpe, eu não entendi essa pergunta.",True
Como devo formatar meu currículo?,"Desculpe, eu não entendi essa pergunta.",False
Como listar minha experiência de trabalho,"Desculpe, eu não entendi essa pergunta.",True
qual o seu nome,"Desculpe, eu não entendi essa pergunta.",False
qual o seu nome ?,"Desculpe, eu não entendi essa pergunta.",True
Como posso fazer meu currículo se destacar visualmente?,"Use um design limpo e profissional, com seções bem organizadas e espaçamento adequado. Evite elementos gráficos excessivos que possam distrair.",True
